{
  "protocol_version": "phase_3_limited_fair_comparison_protocol_v0_1",
  "status": "frozen_protocol_data_readiness_only",
  "authorization": {
    "phase_3_entry_approved": true,
    "current_block": "protocol_and_data_readiness_no_model_execution",
    "model_gpu_notice_required": true
  },
  "evidence_basis": {
    "phase_2_acceptance_path": "results/summaries/phase_2_research_credibility_acceptance_v0_1.json",
    "phase_2_acceptance_sha256": "15ef2b967f550833a7f29e9d348cb61bece449392c9d5522f71910cd43a1259c",
    "confirmatory_steering_gate": "no_go"
  },
  "research_scope": {
    "axis_ids": ["boundary-preserving-over-accommodating"],
    "study_role": "limited_nonconfirmatory_fair_method_comparison",
    "representation_vs_causality": "phase_2_representation_signal_does_not_establish_causal_steering"
  },
  "model": {
    "model_id": "Qwen/Qwen3-4B-Instruct-2507",
    "revision": "cdbee75f17c01a7cc42f958dc650907174af0554",
    "runtime_equivalence_required": true
  },
  "conditions": [
    "base",
    "prompt_only",
    "target_steering",
    "sign_flipped_steering",
    "random_steering",
    "shuffled_steering",
    "qlora"
  ],
  "comparison_invariants": {
    "same_model_revision": true,
    "same_prompt_rows": true,
    "same_decoding": true,
    "same_output_budget": true,
    "paired_outputs": true,
    "condition_blind_human_review": true
  },
  "data_gates": {
    "legacy_sft_forbidden": [
      "data/post_training/boundary_preserving_sft_v0_1.jsonl",
      "data/post_training/boundary_preserving_sft_v0_2.jsonl"
    ],
    "qlora_train": {
      "minimum_human_approved_families": 40,
      "opposite_pole_targets_forbidden": true,
      "template_phrase_rate_maximum": 0.05,
      "exact_duplicate_rate_maximum": 0.0,
      "family_isolated_from_development_and_test": true
    },
    "development": {
      "minimum_families": 15,
      "allowed_uses": ["alpha_selection", "qlora_checkpoint_selection", "protocol_debugging"],
      "human_review_required": true
    },
    "held_out_test": {
      "minimum_families": 40,
      "single_opening": true,
      "new_independent_set_required": true,
      "phase_2_opened_test_reuse_forbidden": true,
      "human_review_required": true
    },
    "leakage_checks": [
      "source_sample",
      "task_family",
      "scenario_family",
      "prompt_template_family",
      "semantic_family",
      "exact_normalized_ngram_and_semantic_near_duplicate"
    ]
  },
  "steering_policy": {
    "layer": 24,
    "pooling": "last_response_token",
    "direction_source": "phase_2_train_only_difference_of_means",
    "alpha_candidates": [1.0, 3.0],
    "alpha_selection_split": "new_development_only",
    "test_retuning_forbidden": true,
    "random_draws": 5,
    "shuffled_draws": 5
  },
  "evaluation": {
    "primary_source": "condition_blind_human_review",
    "primary_dimensions": [
      "trait_expression",
      "helpfulness_or_task_success",
      "naturalness",
      "refusal_appropriateness",
      "over_refusal",
      "sycophancy_or_over_accommodation",
      "useful_alternative",
      "repetition_or_template_style",
      "other_side_effects"
    ],
    "automatic_heuristic_role": "triage_and_separately_reported_sensitivity_only",
    "llm_judge_role": "exploratory_disagreement_sampling_only",
    "human_replacement_allowed": false,
    "required_statistics": [
      "paired_effect_size",
      "family_cluster_bootstrap_ci",
      "family_structure_preserving_permutation",
      "win_tie_loss_counts",
      "quality_non_inferiority",
      "failure_taxonomy"
    ]
  },
  "execution_gates": [
    {"gate_id": "new_data_contract", "status": "blocked"},
    {"gate_id": "human_mapping_and_training_review", "status": "blocked"},
    {"gate_id": "family_leakage_audit", "status": "blocked"},
    {"gate_id": "blind_review_protocol_and_condition_key", "status": "blocked"},
    {"gate_id": "model_gpu_execution_notice", "status": "blocked"}
  ],
  "acceptance": {
    "positive_result_required": false,
    "all_conditions_and_negative_results_reported": true,
    "trait_gain_without_quality_non_inferiority_is_tradeoff_not_improvement": true,
    "phase_2_representation_result_must_remain_separate": true
  },
  "non_goals": [
    "no confirmatory causal steering claim",
    "no reuse of the opened Phase 2 test for tuning or ranking",
    "no assertive-compliant or cautious-impulsive PKU extension",
    "no same_axis_not_opposite contrast",
    "no new Trait axis or broad alpha sweep",
    "no heuristic or LLM Judge replacement for human review",
    "no pipeline quantization dashboard or algebraic-equivalence novelty claim"
  ],
  "claim_boundary": "Phase 3 is user-authorized as a limited nonconfirmatory fair comparison. Execution remains blocked until new human-reviewed family-isolated data and evaluation contracts pass; Phase 2 representation evidence remains distinct from causal intervention evidence."
}
